{"$defs":{"case":{"additionalProperties":false,"properties":{"caseId":{"pattern":"^case-[0-9a-f]{16}$","type":"string"},"domainCaseIndex":{"$ref":"#/$defs/hexU64"},"family":{"type":"string"},"globalCaseIndex":{"$ref":"#/$defs/hexU64"},"requestedObservationKind":{"type":"string"},"selectors":{"$ref":"#/$defs/selectors"}},"required":["caseId","globalCaseIndex","domainCaseIndex","family","requestedObservationKind","selectors"],"type":"object"},"hexU64":{"pattern":"^[0-9a-f]{16}$","type":"string"},"selectors":{"additionalProperties":false,"properties":{"familyParameter":{"$ref":"#/$defs/hexU64"},"formulaVariant":{"$ref":"#/$defs/hexU64"},"intervalWidth":{"$ref":"#/$defs/hexU64"},"multiplicity":{"$ref":"#/$defs/hexU64"},"mutation":{"$ref":"#/$defs/hexU64"},"observationClass":{"$ref":"#/$defs/hexU64"},"reserved":{"$ref":"#/$defs/hexU64"},"sign":{"$ref":"#/$defs/hexU64"},"value":{"$ref":"#/$defs/hexU64"}},"required":["value","familyParameter","observationClass","sign","multiplicity","intervalWidth","formulaVariant","mutation","reserved"],"type":"object"}},"$id":"https://neco.example/schema/algebra-generated-request-batch.v1.json","$schema":"https://json-schema.org/draft/2020-12/schema","additionalProperties":false,"properties":{"adapterRevision":{"const":"algebra-generated-request-v2"},"cases":{"items":{"$ref":"#/$defs/case"},"type":"array"},"domain":{"const":"neco.algebra"},"generator":{"additionalProperties":false,"properties":{"algorithm":{"const":"splitmix64-v1"},"drawScheduleRevision":{"const":"draw-schedule-v1"},"seed":{"$ref":"#/$defs/hexU64"}},"required":["algorithm","drawScheduleRevision","seed"],"type":"object"},"schema":{"const":"neco.verification.generated-request-batch.v1"}},"required":["schema","adapterRevision","domain","generator","cases"],"type":"object"}