{"adapterRevision":"algebra-generated-request-v2","cases":[{"caseId":"case-0000000000000000","domainCaseIndex":"0000000000000000","family":"rational-reduction","globalCaseIndex":"0000000000000000","requestedObservationKind":"success","selectors":{"familyParameter":"0000000000000005","formulaVariant":"0000000000000000","intervalWidth":"0000000000000000","multiplicity":"0000000000000000","mutation":"0000000000000000","observationClass":"0000000000000000","reserved":"0000000000000000","sign":"0000000000000000","value":"0000000000000007"}},{"caseId":"case-0000000000000001","domainCaseIndex":"0000000000000001","family":"extended-gcd-bezout","globalCaseIndex":"0000000000000001","requestedObservationKind":"success","selectors":{"familyParameter":"0000000000000011","formulaVariant":"0000000000000000","intervalWidth":"0000000000000000","multiplicity":"0000000000000000","mutation":"0000000000000000","observationClass":"0000000000000000","reserved":"0000000000000000","sign":"0000000000000000","value":"000000000000001d"}},{"caseId":"case-0000000000000002","domainCaseIndex":"0000000000000002","family":"local-algebraic-root","globalCaseIndex":"0000000000000002","requestedObservationKind":"success","selectors":{"familyParameter":"0000000000000000","formulaVariant":"0000000000000000","intervalWidth":"0000000000000000","multiplicity":"0000000000000000","mutation":"0000000000000000","observationClass":"0000000000000000","reserved":"0000000000000000","sign":"0000000000000000","value":"0000000000000000"}},{"caseId":"case-0000000000000003","domainCaseIndex":"0000000000000003","family":"scalar-f64-projection","globalCaseIndex":"0000000000000003","requestedObservationKind":"success","selectors":{"familyParameter":"0000000000000002","formulaVariant":"0000000000000001","intervalWidth":"0000000000000000","multiplicity":"0000000000000000","mutation":"0000000000000000","observationClass":"0000000000000000","reserved":"0000000000000000","sign":"0000000000000000","value":"0000000000000002"}},{"caseId":"case-0000000000000004","domainCaseIndex":"0000000000000004","family":"rational-linear-unique","globalCaseIndex":"0000000000000004","requestedObservationKind":"success","selectors":{"familyParameter":"0000000000000001","formulaVariant":"0000000000000000","intervalWidth":"0000000000000000","multiplicity":"0000000000000000","mutation":"0000000000000000","observationClass":"0000000000000000","reserved":"0000000000000000","sign":"0000000000000000","value":"0000000000000000"}},{"caseId":"case-0000000000000005","domainCaseIndex":"0000000000000005","family":"rational-linear-affine","globalCaseIndex":"0000000000000005","requestedObservationKind":"success","selectors":{"familyParameter":"0000000000000001","formulaVariant":"0000000000000000","intervalWidth":"0000000000000000","multiplicity":"0000000000000000","mutation":"0000000000000000","observationClass":"0000000000000000","reserved":"0000000000000000","sign":"0000000000000000","value":"0000000000000000"}}],"domain":"neco.algebra","generator":{"algorithm":"splitmix64-v1","drawScheduleRevision":"draw-schedule-v1","seed":"0000000000000000"},"schema":"neco.verification.generated-request-batch.v1"}